<?xml version="1.0" encoding="UTF-8"?>
<empresa  xmlns:xsi="http://www.w3.org/2001/XMLSchema-instance"
                  xsi:noNamespaceSchemaLocation="EmpyDep.xsd">
<departamentos>
<departamento>
<dep_no>10</dep_no>
<dnombre>CONTABILIDAD</dnombre>
<localidad>BARCELONA</localidad>
</departamento>
<departamento>
<dep_no>20</dep_no>
<dnombre>INVESTIGACION</dnombre>
<localidad>VALENCIA</localidad>
</departamento>
<departamento>
<dep_no>30</dep_no>
<dnombre>VENTAS</dnombre>
<localidad>MADRID</localidad>
</departamento>
<departamento>
<dep_no>40</dep_no>
<dnombre>PRODUCCION</dnombre>
<localidad>SEVILLA</localidad>
</departamento>
</departamentos>
<empleados>
<empleado>
<emp_no>7839</emp_no>
<apellido>REY</apellido>
<oficio>PRESIDENTE</oficio>
<director></director>
<fecha_alta>1981-11-17</fecha_alta>
<salario>6000.00</salario>
<dep_no>10</dep_no>
</empleado>
<empleado>
<emp_no>7698</emp_no>
<apellido>GARRIDO</apellido>
<oficio>DIRECTOR</oficio>
<director>7839</director>
<fecha_alta>1981-5-1</fecha_alta>
<salario>3850.00</salario>
<dep_no>30</dep_no>
</empleado>
<empleado>
<emp_no>7499</emp_no>
<apellido>ALONSO</apellido>
<oficio>VENDEDOR</oficio>
<director>7698</director>
<fecha_alta>1981-2-20</fecha_alta>
<salario>1400.00</salario>
<comision>400.00</comision>
<dep_no>30</dep_no>
</empleado>
</empleados>
</empresa>